{
  "$schema": "../../corpus/schemas/artifact.schema.json",
  "schema_version": 1,
  "id": "story:absorption-loop",
  "kind": "story",
  "title": "From a leader's spreadsheet to a killing blow, and back with proof",
  "summary": "Historical 2026-08-06 evidence of a guild tracker becoming a player picker, in-game objective, and human-review evidence; current authority is comfy-quest.",
  "audiences": {
    "primary": ["creator", "moderator"],
    "relevant": ["curious", "player-tester", "admin", "modder", "developer"]
  },
  "canonical_url": "https://djcdevelopment.github.io/baseline/absorption-loop/",
  "published_at": "2026-08-07T06:57:12-07:00",
  "source_files": ["index.html"],
  "facets": {
    "result_first": true,
    "system": "quest-absorption"
  }
}
