{
  "$schema": "../../corpus/schemas/artifact.schema.json",
  "schema_version": 1,
  "id": "portal:baseline",
  "kind": "portal",
  "title": "Baseline",
  "summary": "The public hub for the repository map, durable decisions, evidence, corpus, and discovery surfaces of the Valheim project fleet.",
  "audiences": {
    "primary": ["curious"],
    "relevant": ["player-tester", "creator", "moderator", "admin", "modder", "developer", "contributor"]
  },
  "canonical_url": "https://djcdevelopment.github.io/baseline/",
  "published_at": "2026-08-06T00:00:00-07:00",
  "source_files": ["landing.html", "build_landing.py", "tokens.css"],
  "facets": {
    "durable": true,
    "surface": "github-pages"
  }
}
